{
  "$schema": "http://json-schema.org/draft-07/schema#",
  "$id": "https://akm.dev/schemas/bench-run-config.schema.json",
  "title": "akm-bench run config",
  "description": "Single-file description of a bench utility/evolve run: opencode config, model, tasks, arms, seeds, budgets, parallel, baseline. Loaded by src/run-config.ts.",
  "type": "object",
  "additionalProperties": false,
  "required": ["schemaVersion"],
  "properties": {
    "$schema": { "type": "string" },
    "schemaVersion": {
      "const": 1,
      "description": "Locked at 1 for the v1 bench-run-config contract."
    },
    "name": {
      "type": "string",
      "description": "Short human-readable identifier, e.g. \"nano-quick\". Used in output filenames."
    },
    "description": {
      "type": "string",
      "description": "Free-form note about what this run measures."
    },

    "opencodeConfig": {
      "type": "object",
      "description": "Inline standard opencode config object. Bench reads only its `model` and `provider` fields. Mutually exclusive with opencodeConfigRef."
    },
    "opencodeConfigRef": {
      "type": "string",
      "description": "Path to a standard opencode JSON config file. Resolved relative to this config's directory. Supports absolute paths, ~/... (tilde expansion), and ${VAR}/... (env-var expansion). Mutually exclusive with `opencodeConfig`."
    },

    "model": {
      "type": "string",
      "description": "Override the opencode config file's model. BENCH_OPENCODE_MODEL env still wins over both."
    },

    "tasks": {
      "description": "Task selector: \"all\" | \"train\" | \"eval\" (slice), a domain id (e.g. \"drillbit\"), a single task id (\"drillbit/backup-policy\"), or an array of task ids.",
      "oneOf": [
        { "type": "string" },
        {
          "type": "array",
          "items": { "type": "string" },
          "minItems": 1
        }
      ]
    },

    "arms": {
      "type": "array",
      "description": "Arms to run. Order is preserved. Allowed values: \"noakm\", \"akm\", \"synthetic\".",
      "items": { "enum": ["noakm", "akm", "synthetic"] },
      "minItems": 1,
      "uniqueItems": true
    },

    "seeds": {
      "type": "integer",
      "description": "Number of seeds per arm. Defaults to 5 when omitted.",
      "minimum": 1
    },
    "budgetTokens": {
      "type": "integer",
      "description": "Per-run token budget. Defaults to the runner's built-in default (30000) when omitted.",
      "minimum": 1
    },
    "budgetWallMs": {
      "type": "integer",
      "description": "Per-run wallclock budget in milliseconds. Defaults to the runner's built-in default (120000) when omitted.",
      "minimum": 1
    },
    "parallel": {
      "type": "integer",
      "description": "Number of (task, arm, seed) triples to run concurrently. Default 1 (sequential). Clamped to [1, 8].",
      "minimum": 1,
      "maximum": 8
    },
    "forceParallel": {
      "type": "boolean",
      "description": "Suppress the high-parallelism warning when parallel > 4."
    },

    "baseline": {
      "type": "string",
      "description": "Optional path to a baseline JSON file: { taskId: passRate (0..1) }. Resolved relative to this config (with ~/${VAR} expansion). Adds a delta column to the markdown summary and a `baseline_by_task_id` field to the JSON envelope."
    }
  },
  "allOf": [
    {
      "description": "opencodeConfig and opencodeConfigRef are mutually exclusive.",
      "not": {
        "type": "object",
        "required": ["opencodeConfig", "opencodeConfigRef"]
      }
    }
  ]
}
